{"$schema":"./schemas/target-media-qualification-evidence.schema.json","artifactClass":"TARGET_MEDIA_SINGLE_CARD_CAPACITY_QUALIFICATION","batchId":"single-card-20260826-a","deviceClass":"TF_CARD","marketedCapacityBytes":32000000000,"marketedCapacityGB":32,"measuredAt":"2026-08-26T11:44:20Z","measurementTool":"PowerShell Get-Disk.Size","measurements":[{"logicalSectorBytes":512,"measuredBytes":31268536320,"sampleId":"single-card-a","wholeDevice":true}],"method":"WINDOWS_STORAGE_API_SINGLE_CARD_V1","minimumQualifiedMediaBytes":31268536320,"qualificationState":"QUALIFIED","sampleSelection":"SINGLE_CARD_PROJECT_OWNER_ACCEPTED","schemaVersion":1}
